{
  "manifestVersion": "1.0.0",
  "propertySlug": "example-property",
  "kitVersion": "kit-v2.0.0",
  "reviewStatus": "APPROVED",
  "reviewedBy": "Fictional release fixture reviewer",
  "reviewedAt": "2026-08-18T00:00:00Z",
  "entries": [
    { "name": "APPFOLIO_CLIENT_ID", "classification": "account-secret-link", "artifact": "api-server", "environment": "production", "required": true, "owner": "Fictional operator", "accountSecretName": "APPFOLIO_CLIENT_ID", "scopeVerified": true, "approval": "APPROVED", "approvedBy": "Fictional reviewer", "approvedAt": "2026-08-18T00:00:00Z", "status": "LINKED", "notes": "Metadata-only release fixture." },
    { "name": "APPFOLIO_CLIENT_SECRET", "classification": "account-secret-link", "artifact": "api-server", "environment": "production", "required": true, "owner": "Fictional operator", "accountSecretName": "APPFOLIO_CLIENT_SECRET", "scopeVerified": true, "approval": "APPROVED", "approvedBy": "Fictional reviewer", "approvedAt": "2026-08-18T00:00:00Z", "status": "LINKED", "notes": "Metadata-only release fixture." },
    { "name": "DATABASE_URL", "classification": "property-secret", "artifact": "api-server", "environment": "production", "required": true, "owner": "Fictional operator", "approval": "APPROVED", "approvedBy": "Fictional reviewer", "approvedAt": "2026-08-18T00:00:00Z", "status": "CONFIGURED", "notes": "Metadata only; no value." },
    { "name": "GMAIL_APP_PASSWORD", "classification": "property-secret", "artifact": "api-server", "environment": "production", "required": true, "owner": "Fictional operator", "approval": "APPROVED", "approvedBy": "Fictional reviewer", "approvedAt": "2026-08-18T00:00:00Z", "status": "CONFIGURED", "notes": "Metadata only; no value." },
    { "name": "GMAIL_SMTP_USER", "classification": "non-secret", "artifact": "api-server", "environment": "production", "required": true, "owner": "Fictional operator", "approval": "APPROVED", "approvedBy": "Fictional reviewer", "approvedAt": "2026-08-18T00:00:00Z", "status": "CONFIGURED" },
    { "name": "LEASING_INBOX_EMAIL", "classification": "non-secret", "artifact": "api-server", "environment": "production", "required": true, "owner": "Fictional operator", "approval": "APPROVED", "approvedBy": "Fictional reviewer", "approvedAt": "2026-08-18T00:00:00Z", "status": "CONFIGURED" },
    { "name": "SEED_ALERT_EMAIL", "classification": "non-secret", "artifact": "api-server", "environment": "production", "required": true, "owner": "Fictional operator", "approval": "APPROVED", "approvedBy": "Fictional reviewer", "approvedAt": "2026-08-18T00:00:00Z", "status": "CONFIGURED" },
    { "name": "INDEXNOW_KEY", "classification": "property-secret", "artifact": "api-server", "environment": "production", "required": true, "owner": "Fictional operator", "approval": "APPROVED", "approvedBy": "Fictional reviewer", "approvedAt": "2026-08-18T00:00:00Z", "status": "CONFIGURED" },
    { "name": "SESSION_SECRET", "classification": "property-secret", "artifact": "api-server", "environment": "production", "required": true, "owner": "Fictional operator", "approval": "APPROVED", "approvedBy": "Fictional reviewer", "approvedAt": "2026-08-18T00:00:00Z", "status": "CONFIGURED" },
    { "name": "VITE_API_URL", "classification": "non-secret", "artifact": "web", "environment": "production", "required": true, "owner": "Fictional operator", "approval": "APPROVED", "approvedBy": "Fictional reviewer", "approvedAt": "2026-08-18T00:00:00Z", "status": "CONFIGURED" },
    { "name": "VITE_UTM_STORAGE_KEY", "classification": "non-secret", "artifact": "web", "environment": "production", "required": true, "owner": "Fictional operator", "approval": "APPROVED", "approvedBy": "Fictional reviewer", "approvedAt": "2026-08-18T00:00:00Z", "status": "CONFIGURED" },
    { "name": "VITE_GA4_MEASUREMENT_ID", "classification": "non-secret", "artifact": "web", "environment": "production", "required": true, "owner": "Fictional operator", "approval": "APPROVED", "approvedBy": "Fictional reviewer", "approvedAt": "2026-08-18T00:00:00Z", "status": "CONFIGURED" }
  ]
}