{
  "manifestVersion": "1.0.0",
  "propertySlug": "example-property",
  "kitVersion": "kit-v2.0.0",
  "reviewStatus": "DRAFT",
  "entries": [
    { "name": "APPFOLIO_CLIENT_ID", "classification": "account-secret-link", "artifact": "api-server", "environment": "production", "required": true, "owner": "Property operator", "accountSecretName": "APPFOLIO_CLIENT_ID", "scopeVerified": false, "approval": "PENDING", "status": "NOT_CONFIGURED", "notes": "Account credential scope must be reviewed before linking." },
    { "name": "APPFOLIO_CLIENT_SECRET", "classification": "account-secret-link", "artifact": "api-server", "environment": "production", "required": true, "owner": "Property operator", "accountSecretName": "APPFOLIO_CLIENT_SECRET", "scopeVerified": false, "approval": "PENDING", "status": "NOT_CONFIGURED", "notes": "Account credential scope must be reviewed before linking." },
    { "name": "DATABASE_URL", "classification": "property-secret", "artifact": "api-server", "environment": "production", "required": true, "owner": "Property operator", "approval": "PENDING", "status": "NOT_CONFIGURED", "notes": "PostgreSQL connection string; never commit a value." },
    { "name": "GMAIL_APP_PASSWORD", "classification": "property-secret", "artifact": "api-server", "environment": "production", "required": true, "owner": "Property operator", "approval": "PENDING", "status": "NOT_CONFIGURED", "notes": "Dedicated mailbox credential; never commit a value." },
    { "name": "GMAIL_SMTP_USER", "classification": "non-secret", "artifact": "api-server", "environment": "production", "required": true, "owner": "Property operator", "approval": "PENDING", "status": "NOT_CONFIGURED", "notes": "Approved sender address." },
    { "name": "LEASING_INBOX_EMAIL", "classification": "non-secret", "artifact": "api-server", "environment": "production", "required": true, "owner": "Property operator", "approval": "PENDING", "status": "NOT_CONFIGURED" },
    { "name": "SEED_ALERT_EMAIL", "classification": "non-secret", "artifact": "api-server", "environment": "production", "required": true, "owner": "Property operator", "approval": "PENDING", "status": "NOT_CONFIGURED" },
    { "name": "INDEXNOW_KEY", "classification": "property-secret", "artifact": "api-server", "environment": "production", "required": true, "owner": "Property operator", "approval": "PENDING", "status": "NOT_CONFIGURED", "notes": "Property-specific IndexNow key." },
    { "name": "SESSION_SECRET", "classification": "property-secret", "artifact": "api-server", "environment": "production", "required": true, "owner": "Property operator", "approval": "PENDING", "status": "NOT_CONFIGURED", "notes": "Property-scoped session signing secret." },
    { "name": "VITE_API_URL", "classification": "non-secret", "artifact": "web", "environment": "production", "required": true, "owner": "Property operator", "approval": "PENDING", "status": "NOT_CONFIGURED", "notes": "Public production API origin." },
    { "name": "VITE_UTM_STORAGE_KEY", "classification": "non-secret", "artifact": "web", "environment": "production", "required": true, "owner": "Property operator", "approval": "PENDING", "status": "NOT_CONFIGURED", "notes": "Public browser storage key." },
    { "name": "VITE_GA4_MEASUREMENT_ID", "classification": "non-secret", "artifact": "web", "environment": "production", "required": true, "owner": "Property operator", "approval": "PENDING", "status": "NOT_CONFIGURED", "notes": "Public measurement identifier." }
  ]
}