{
  "manifestVersion": "1.0.0",
  "propertySlug": "exhibit-on-superior",
  "kitVersion": "kit-v1.1.0",
  "reviewStatus": "APPROVED",
  "reviewedBy": "Existing production configuration migration",
  "reviewedAt": "2026-08-31T00:00:00Z",
  "entries": [
    {
      "name": "APPFOLIO_CLIENT_ID",
      "classification": "account-secret-link",
      "artifact": "api-server",
      "environment": "production",
      "required": true,
      "owner": "Highland operations",
      "accountSecretName": "APPFOLIO_CLIENT_ID",
      "scopeVerified": true,
      "approval": "APPROVED",
      "approvedBy": "Existing production configuration migration",
      "approvedAt": "2026-08-31T00:00:00Z",
      "status": "LINKED",
      "notes": "Metadata migrated from the already-live Exhibit deployment; no value is stored here."
    },
    {
      "name": "APPFOLIO_CLIENT_SECRET",
      "classification": "account-secret-link",
      "artifact": "api-server",
      "environment": "production",
      "required": true,
      "owner": "Highland operations",
      "accountSecretName": "APPFOLIO_CLIENT_SECRET",
      "scopeVerified": true,
      "approval": "APPROVED",
      "approvedBy": "Existing production configuration migration",
      "approvedAt": "2026-08-31T00:00:00Z",
      "status": "LINKED",
      "notes": "Metadata migrated from the already-live Exhibit deployment; no value is stored here."
    },
    {
      "name": "GMAIL_APP_PASSWORD",
      "classification": "property-secret",
      "artifact": "api-server",
      "environment": "production",
      "required": true,
      "owner": "Highland operations",
      "approval": "APPROVED",
      "approvedBy": "Existing production configuration migration",
      "approvedAt": "2026-08-31T00:00:00Z",
      "status": "CONFIGURED",
      "notes": "Metadata only; no value is stored here."
    },
    {
      "name": "GMAIL_SMTP_USER",
      "classification": "non-secret",
      "artifact": "api-server",
      "environment": "production",
      "required": true,
      "owner": "Highland operations",
      "approval": "APPROVED",
      "approvedBy": "Existing production configuration migration",
      "approvedAt": "2026-08-31T00:00:00Z",
      "status": "CONFIGURED"
    },
    {
      "name": "INDEXNOW_KEY",
      "classification": "property-secret",
      "artifact": "api-server",
      "environment": "production",
      "required": true,
      "owner": "Highland operations",
      "approval": "APPROVED",
      "approvedBy": "Existing production configuration migration",
      "approvedAt": "2026-08-31T00:00:00Z",
      "status": "CONFIGURED",
      "notes": "Metadata only; no value is stored here."
    },
    {
      "name": "VITE_UTM_STORAGE_KEY",
      "classification": "non-secret",
      "artifact": "exhibit-on-superior",
      "environment": "production",
      "required": true,
      "owner": "Highland operations",
      "approval": "APPROVED",
      "approvedBy": "Existing production configuration migration",
      "approvedAt": "2026-08-31T00:00:00Z",
      "status": "CONFIGURED"
    },
    {
      "name": "VITE_GA4_MEASUREMENT_ID",
      "classification": "non-secret",
      "artifact": "exhibit-on-superior",
      "environment": "production",
      "required": true,
      "owner": "Highland operations",
      "approval": "APPROVED",
      "approvedBy": "Existing production configuration migration",
      "approvedAt": "2026-08-31T00:00:00Z",
      "status": "CONFIGURED"
    },
    {
      "name": "SESSION_SECRET",
      "classification": "property-secret",
      "artifact": "api-server",
      "environment": "production",
      "required": true,
      "owner": "Highland operations",
      "approval": "APPROVED",
      "approvedBy": "Existing production configuration migration",
      "approvedAt": "2026-08-31T00:00:00Z",
      "status": "CONFIGURED",
      "notes": "Metadata only; no value is stored here."
    },
    {
      "name": "VITE_API_URL",
      "classification": "non-secret",
      "artifact": "exhibit-on-superior",
      "environment": "production",
      "required": true,
      "owner": "Highland operations",
      "approval": "APPROVED",
      "approvedBy": "Existing production configuration migration",
      "approvedAt": "2026-08-31T00:00:00Z",
      "status": "CONFIGURED"
    },
    {
      "name": "LEASING_INBOX_EMAIL",
      "classification": "non-secret",
      "artifact": "api-server",
      "environment": "production",
      "required": true,
      "owner": "Highland operations",
      "approval": "APPROVED",
      "approvedBy": "Existing production configuration migration",
      "approvedAt": "2026-08-31T00:00:00Z",
      "status": "CONFIGURED"
    },
    {
      "name": "SEED_ALERT_EMAIL",
      "classification": "non-secret",
      "artifact": "api-server",
      "environment": "production",
      "required": true,
      "owner": "Highland operations",
      "approval": "APPROVED",
      "approvedBy": "Existing production configuration migration",
      "approvedAt": "2026-08-31T00:00:00Z",
      "status": "CONFIGURED"
    }
  ]
}