{
  "manifestVersion": "1.0.0",
  "propertySlug": "woods-crossing",
  "kitVersion": "kit-v2.0.0",
  "reviewStatus": "DRAFT",
  "entries": [
    {
      "name": "APPFOLIO_CLIENT_ID",
      "classification": "account-secret-link",
      "artifact": "api-server",
      "environment": "production",
      "required": true,
      "owner": "credential owner to confirm",
      "accountSecretName": "APPFOLIO_CLIENT_ID",
      "scopeVerified": false,
      "approval": "PENDING",
      "status": "NOT_CONFIGURED"
    },
    {
      "name": "APPFOLIO_CLIENT_SECRET",
      "classification": "account-secret-link",
      "artifact": "api-server",
      "environment": "production",
      "required": true,
      "owner": "credential owner to confirm",
      "accountSecretName": "APPFOLIO_CLIENT_SECRET",
      "scopeVerified": false,
      "approval": "PENDING",
      "status": "NOT_CONFIGURED"
    },
    {
      "name": "GMAIL_APP_PASSWORD",
      "classification": "account-secret-link",
      "artifact": "api-server",
      "environment": "production",
      "required": true,
      "owner": "mailbox owner to confirm",
      "accountSecretName": "GMAIL_APP_PASSWORD",
      "scopeVerified": false,
      "approval": "PENDING",
      "status": "NOT_CONFIGURED"
    },
    {
      "name": "GMAIL_SMTP_USER",
      "classification": "non-secret",
      "artifact": "api-server",
      "environment": "production",
      "required": true,
      "owner": "property application operator",
      "approval": "PENDING",
      "status": "NOT_CONFIGURED"
    },
    {
      "name": "INDEXNOW_KEY",
      "classification": "property-secret",
      "artifact": "api-server",
      "environment": "production",
      "required": true,
      "owner": "property application operator",
      "approval": "PENDING",
      "status": "NOT_CONFIGURED"
    },
    {
      "name": "VITE_UTM_STORAGE_KEY",
      "classification": "non-secret",
      "artifact": "web",
      "environment": "production",
      "required": true,
      "owner": "property application operator",
      "approval": "PENDING",
      "status": "NOT_CONFIGURED"
    },
    {
      "name": "VITE_GA4_MEASUREMENT_ID",
      "classification": "non-secret",
      "artifact": "web",
      "environment": "production",
      "required": true,
      "owner": "analytics owner",
      "approval": "PENDING",
      "status": "NOT_CONFIGURED"
    },
    {
      "name": "SESSION_SECRET",
      "classification": "property-secret",
      "artifact": "api-server",
      "environment": "production",
      "required": true,
      "owner": "property application operator",
      "approval": "PENDING",
      "status": "NOT_CONFIGURED"
    }
  ]
}